<?xml version="1.0" encoding="UTF-8"?>
<diversity xmlns="http://www.sagframe.com/schema/diversity"
	xmlns:xsi="http://www.w3.org/2001/XMLSchema-instance"
	xsi:schemaLocation="http://www.sagframe.com/schema/diversity http://www.sagframe.com/schema/sagacity-diversity.xsd"
	include-tables="(?i)\w+">
	<!-- 测试 -->
	<reference-db name="uat">
		<url><![CDATA[jdbc:mysql://192.168.56.109:3306/sqltoy?useUnicode=true&characterEncoding=utf-8&useSSL=false&serverTimezone=GMT%2B8]]>
		</url>
		<driver value="com.mysql.cj.jdbc.Driver" />
		<username value="sqltoy" />
		<password value="sqltoy" />
		<catalog value="sqltoy" />
		<schema value="sqltoy" />
	</reference-db>

	<target-db name="prod">
		<url><![CDATA[jdbc:mysql://192.168.56.109:3306/sqltoy_sharding1?useUnicode=true&characterEncoding=utf-8&useSSL=false&serverTimezone=GMT%2B8]]>
		</url>
		<driver value="com.mysql.cj.jdbc.Driver" />
		<username value="sqltoy_sharding1" />
		<password value="sqltoy_sharding1" />
		<catalog value="sqltoy_sharding1" />
		<schema value="sqltoy_sharding1" />
	</target-db>
	
</diversity>