<?xml version="1.0" encoding="UTF-8"?>
<diversity xmlns="http://www.sagframe.com/schema/diversity"
	xmlns:xsi="http://www.w3.org/2001/XMLSchema-instance"
	xsi:schemaLocation="http://www.sagframe.com/schema/diversity http://www.sagframe.com/schema/sagacity-diversity.xsd"
	include-tables="(?i)\w+">
	<!-- 测试 -->
	<reference-db name="test">
		<url><![CDATA[jdbc:mysql://192.168.56.101:3306/sagacity?useUnicode=true&characterEncoding=utf-8&useSSL=false&serverTimezone=GMT%2B8]]>
		</url>
		<driver value="com.mysql.cj.jdbc.Driver" />
		<username value="dev" />
		<password value="dev" />
		<catalog value="dev" />
		<schema value="dev" />
	</reference-db>

	
	<target-db name="uat">
		<url><![CDATA[jdbc:mysql://192.168.56.102:3306/sagacity?useUnicode=true&characterEncoding=utf-8&useSSL=false&serverTimezone=GMT%2B8]]>
		</url>
		<driver value="com.mysql.cj.jdbc.Driver" />
		<username value="uat" />
		<password value="uat" />
		<catalog value="uat" />
		<schema value="uat" />
	</target-db>
	
</diversity>